{
  "envelope_version": 1,
  "key_id": "fixture-release-key-1",
  "payload": "eyJjYXRhbG9nX3NjaGVtYV92ZXJzaW9uIjoxLCJjb3ZlcmFnZSI6eyJkZXNjcmlwdGlvbl9ub3RlX2RlZmluaXRpb25zIjpmYWxzZSwiZXZvbHV0aW9ucyI6dHJ1ZSwicGV0cyI6dHJ1ZSwic2tpbGxfc3RvbmVfdG9waWNzIjpmYWxzZSwic2tpbGxzIjp0cnVlLCJ0b3BpY19yZXdhcmRzIjpmYWxzZX0sImRhdGFfdmVyc2lvbiI6MiwiZGF0YXNldF9pZCI6InJvY28td29ybGQtemgtY24iLCJtaW5pbXVtX2FwcF92ZXJzaW9uIjoiMS4wLjAiLCJtaW5pbXVtX3Byb3RvY29sX3ZlcnNpb24iOjEsInBhY2thZ2UiOnsiYXJjaGl2ZV9ieXRlcyI6NTEsImFyY2hpdmVfZm9ybWF0IjoiemlwIiwiYXJjaGl2ZV9zaGEyNTYiOiIxZjRkN2Y3MGViNmE4NDNhYzlkMjQ2NzQ0YzE1NTM2MWRlMTY1OGNkZGY3ODY0YzIxM2NhZWQxZDgzMDMzYTExIiwia2luZCI6ImNvbXBsZXRlX2NhdGFsb2ciLCJ1cmwiOiJodHRwczovL3VwZGF0ZXMuZXhhbXBsZS50ZXN0L2Z1bGwvY2F0YWxvZy12Mi56aXAifSwicHJvdG9jb2xfdmVyc2lvbiI6MSwicHVibGlzaGVkX2F0X3V0YyI6IjIwMjYtMDktMDlUMTM6NDA6MDBaIiwicmVsZWFzZV9zZXF1ZW5jZSI6Miwic25hcHNob3RfaWQiOiJzbmFwc2hvdC1waGFzZTctZml4dHVyZS12MiJ9",
  "payload_encoding": "base64url",
  "signature": "sNEmekd_RCpFyUrrJuU1MQQGGzeFNTIjxhoSrxphh9S9Vs6lfZRN853aW4uTR46e6NoCXiQ0GBKDkZpzSHdWDw",
  "signature_algorithm": "ed25519"
}
